{
  "id": "tech.nt.reduce-modulo-structure",
  "entity_type": "technique",
  "schema_version": "1.0.0",
  "status": "published",
  "technique_kind": "number-theoretic",
  "primary_topic_ids": ["nt.congruences-modular-arithmetic"],
  "name": "Reduce Modulo a Useful Structure",
  "slug": "reduce-modulo-a-useful-structure",
  "summary": {
    "source_format": "markdown",
    "plain_text": "Choose a modulus that preserves the target quantity while shrinking large expressions into a short cycle.",
    "markdown": "Choose a modulus that preserves the target quantity while shrinking large expressions into a short cycle."
  },
  "trigger_conditions": [
    {
      "source_format": "markdown",
      "plain_text": "Large exponents or divisibility conditions appear, and only the remainder matters.",
      "markdown": "Large exponents or divisibility conditions appear, and only the remainder matters."
    }
  ],
  "method_steps": [
    {
      "source_format": "markdown",
      "plain_text": "Identify the exact modulus the problem asks about or the modulus that exposes the obstruction.",
      "markdown": "Identify the exact modulus the problem asks about or the modulus that exposes the obstruction."
    },
    {
      "source_format": "markdown",
      "plain_text": "Normalize the expression with congruence rules, keeping only operations valid modulo n.",
      "markdown": "Normalize the expression with congruence rules, keeping only operations valid modulo $n$."
    },
    {
      "source_format": "markdown",
      "plain_text": "Look for periodicity, inverses, or a theorem that shortens the exponent.",
      "markdown": "Look for periodicity, inverses, or a theorem that shortens the exponent."
    }
  ],
  "tracking_profile": {
    "is_trackable": true,
    "mastery_weight": 0.8,
    "review_priority": "high",
    "completion_criteria": ["understand", "apply", "solve", "review"],
    "estimated_effort_minutes": 20
  },
  "prerequisite_refs": [
    {
      "entity_type": "definition",
      "id": "def.nt.congruence-modulo-n"
    }
  ],
  "used_definition_ids": ["def.nt.congruence-modulo-n"],
  "used_theorem_ids": ["thm.nt.fermat-little-theorem"],
  "example_ids": ["ex.nt.modular-inverse-check"],
  "problem_ids": ["prob.nt.remainder-7-power-100-mod-13"],
  "failure_modes": [
    {
      "source_format": "markdown",
      "plain_text": "Cancelling a factor that is not invertible modulo the chosen modulus.",
      "markdown": "Cancelling a factor that is not invertible modulo the chosen modulus."
    }
  ],
  "audit": {
    "created_at": "2026-03-09T08:13:00Z",
    "updated_at": "2026-03-09T08:13:00Z",
    "created_by": "seed.bot",
    "updated_by": "seed.bot"
  }
}
